{
  "jac": "0.5",
  "type": "chain-fragment",
  "event_count": 3,
  "events": [
    {
      "jep": "1",
      "verb": "D",
      "who": "did:example:human-123",
      "when": 1742345681,
      "what": {
        "claim": "delegate",
        "scope": "summarize-document"
      },
      "nonce": "11111111-1111-4111-8111-111111111111",
      "aud": "https://platform.example.com",
      "ref": null,
      "ext": {
        "https://jac.org/chain": {
          "based_on": null,
          "based_on_type": "chain-root",
          "relation": "chain-root",
          "observed_log_assumption": "partial"
        }
      },
      "ext_crit": [
        "https://jac.org/chain"
      ],
      "sig": "PLACEHOLDER_DETACHED_JWS"
    },
    {
      "jep": "1",
      "verb": "J",
      "who": "did:example:agent-789",
      "when": 1742345690,
      "what": "sha256:aaaaaaaaaaaaaaaaaaaaaaaaaaaaaaaaaaaaaaaaaaaaaaaaaaaaaaaaaaaaaaaa",
      "nonce": "22222222-2222-4222-8222-222222222222",
      "aud": "https://platform.example.com",
      "ref": "sha256:1111111111111111111111111111111111111111111111111111111111111111",
      "ext": {
        "https://jac.org/chain": {
          "based_on": "sha256:1111111111111111111111111111111111111111111111111111111111111111",
          "based_on_type": "jep-event",
          "relation": "delegated-from",
          "observed_log_assumption": "partial"
        }
      },
      "ext_crit": [
        "https://jac.org/chain"
      ],
      "sig": "PLACEHOLDER_DETACHED_JWS"
    },
    {
      "jep": "1",
      "verb": "J",
      "who": "did:example:agent-789",
      "when": 1742345700,
      "what": {
        "claim": "chain break declared",
        "reason": "parent unavailable"
      },
      "nonce": "33333333-3333-4333-8333-333333333333",
      "aud": "https://platform.example.com",
      "ref": null,
      "ext": {
        "https://jac.org/chain": {
          "based_on": null,
          "based_on_type": "declared-break",
          "relation": "declared-break",
          "observed_log_assumption": "partial",
          "note": "Parent event unavailable in observed log."
        }
      },
      "ext_crit": [
        "https://jac.org/chain"
      ],
      "sig": "PLACEHOLDER_DETACHED_JWS"
    }
  ]
}
